Read from src/Packages/Reteta.csv, Tue May 05 00:14:06 EEST 2020
Write in src/Packages/Reteta.csv, Tue May 05 00:14:06 EEST 2020
Read from src/Packages/Pacient.csv, Tue May 05 00:14:06 EEST 2020
Write in src/Packages/Pacient.csv, Tue May 05 00:14:06 EEST 2020
Read from src/Packages/Animale.csv, Tue May 05 00:14:06 EEST 2020
Write in src/Packages/Animale.csv, Tue May 05 00:14:06 EEST 2020
Read from src/Packages/Medic.csv, Tue May 05 00:14:06 EEST 2020
Write in src/Packages/Medic.csv, Tue May 05 00:14:06 EEST 2020
